[
  {
    "id": "consultants_assessment_01_role_modern_hair_restoration",
    "programId": "program_certificate_consultation_patient_coordination",
    "levelId": "level_consultants_foundation_certificate",
    "moduleId": "consultants_module_01_role_modern_hair_restoration",
    "slug": "role-modern-hair-restoration-assessment",
    "title": "Role and Scope Assessment",
    "assessmentType": "weekly-quiz",
    "status": "draft",
    "instructions": "Knowledge check aligned with Teaching Manual Volume 1 Week 1: coordinated modern clinic, consultant/nurse support role, patient journey, and scope-safe boundaries (inform, screen, document, escalate—not diagnose or replace doctor decisions).",
    "passMark": 80,
    "retryLimit": 2,
    "weighting": 5,
    "facultyReviewRequired": false,
    "mandatoryDomainTags": ["ethics-scope"],
    "competencyIds": ["consultants_competency_01_role_scope_foundations"],
    "itemIds": ["consultants_item_01"],
    "submissionRules": {
      "allowDraftSave": false,
      "acceptedFormats": ["online"],
      "facultyReviewRequired": false
    },
    "completionRules": {
      "passMarkRequired": true,
      "facultyApprovalRequired": false,
      "mandatoryDomainTags": ["ethics-scope"]
    }
  },
  {
    "id": "consultants_assessment_02_foundations_hair_scalp_science",
    "programId": "program_certificate_consultation_patient_coordination",
    "levelId": "level_consultants_foundation_certificate",
    "moduleId": "consultants_module_02_foundations_hair_scalp_science",
    "slug": "hair-scalp-science-assessment",
    "title": "Hair and Scalp Science Assessment",
    "assessmentType": "weekly-quiz",
    "status": "draft",
    "instructions": "Knowledge check aligned with Volume 1 Week 3: follicle and cycle literacy, density versus calibre, plain-language education, and handover neutrality without diagnostic claims.",
    "passMark": 80,
    "retryLimit": 2,
    "weighting": 5,
    "facultyReviewRequired": false,
    "mandatoryDomainTags": ["knowledge"],
    "competencyIds": ["consultants_competency_02_hair_scalp_literacy"],
    "itemIds": ["consultants_item_02"],
    "submissionRules": {
      "allowDraftSave": false,
      "acceptedFormats": ["online"],
      "facultyReviewRequired": false
    },
    "completionRules": {
      "passMarkRequired": true,
      "facultyApprovalRequired": false,
      "mandatoryDomainTags": ["knowledge"]
    }
  },
  {
    "id": "consultants_assessment_03_common_hair_loss_presentations",
    "programId": "program_certificate_consultation_patient_coordination",
    "levelId": "level_consultants_foundation_certificate",
    "moduleId": "consultants_module_03_common_hair_loss_presentations",
    "slug": "common-presentations-assessment",
    "title": "Common Presentations Assessment",
    "assessmentType": "image-interpretation",
    "status": "draft",
    "instructions": "Interpret presentation scenarios using Volume 1 Week 4 themes: descriptive pattern language, red-flag awareness, disciplined uncertainty, and escalation instead of reassurance or diagnosis.",
    "passMark": 80,
    "retryLimit": 2,
    "weighting": 5,
    "facultyReviewRequired": false,
    "mandatoryDomainTags": ["red-flags"],
    "competencyIds": ["consultants_competency_03_presentation_literacy"],
    "itemIds": ["consultants_item_03"],
    "submissionRules": {
      "allowDraftSave": false,
      "acceptedFormats": ["online"],
      "facultyReviewRequired": false
    },
    "completionRules": {
      "passMarkRequired": true,
      "facultyApprovalRequired": false,
      "mandatoryDomainTags": ["red-flags"]
    }
  },
  {
    "id": "consultants_assessment_04_consultation_structure_information_gathering",
    "programId": "program_certificate_consultation_patient_coordination",
    "levelId": "level_consultants_foundation_certificate",
    "moduleId": "consultants_module_04_consultation_structure_information_gathering",
    "slug": "consultation-structure-assessment",
    "title": "Consultation Structure Assessment",
    "assessmentType": "documentation-exercise",
    "status": "draft",
    "instructions": "Complete the information-gathering and consultation structure exercise.",
    "passMark": 80,
    "retryLimit": 2,
    "weighting": 6,
    "facultyReviewRequired": true,
    "mandatoryDomainTags": ["documentation", "communication"],
    "competencyIds": ["consultants_competency_04_structured_information_gathering"],
    "itemIds": ["consultants_item_04"],
    "submissionRules": {
      "allowDraftSave": true,
      "acceptedFormats": ["online", "text"],
      "facultyReviewRequired": true
    },
    "completionRules": {
      "passMarkRequired": true,
      "facultyApprovalRequired": true,
      "mandatoryDomainTags": ["documentation", "communication"]
    }
  },
  {
    "id": "consultants_assessment_05_candidate_screening_suitability_support",
    "programId": "program_certificate_consultation_patient_coordination",
    "levelId": "level_consultants_foundation_certificate",
    "moduleId": "consultants_module_05_candidate_screening_suitability_support",
    "slug": "candidate-screening-assessment",
    "title": "Candidate Screening Assessment",
    "assessmentType": "case-triage-task",
    "status": "draft",
    "instructions": "Review the screening case and identify safe next steps and escalation points.",
    "passMark": 80,
    "retryLimit": 2,
    "weighting": 6,
    "facultyReviewRequired": false,
    "mandatoryDomainTags": ["red-flags", "escalation"],
    "competencyIds": ["consultants_competency_05_candidate_screening_support"],
    "itemIds": ["consultants_item_05"],
    "submissionRules": {
      "allowDraftSave": true,
      "acceptedFormats": ["online"],
      "facultyReviewRequired": false
    },
    "completionRules": {
      "passMarkRequired": true,
      "facultyApprovalRequired": false,
      "mandatoryDomainTags": ["red-flags", "escalation"]
    }
  },
  {
    "id": "consultants_assessment_06_ethics_consent_scope_of_practice",
    "programId": "program_certificate_consultation_patient_coordination",
    "levelId": "level_consultants_advanced_certificate",
    "moduleId": "consultants_module_06_ethics_consent_scope_of_practice",
    "slug": "ethics-scope-assessment",
    "title": "Ethics, Consent Support, and Scope Assessment",
    "assessmentType": "ethical-judgement-task",
    "status": "draft",
    "instructions": "Respond to ethics and scope scenarios aligned with Volume 1 Week 2: statutory scope, consent support versus clinical consent, honesty, confidentiality, and refusal of unsafe instructions. Mandatory pass applies.",
    "passMark": 80,
    "retryLimit": 2,
    "weighting": 8,
    "facultyReviewRequired": true,
    "mandatoryDomainTags": ["ethics-scope"],
    "competencyIds": ["consultants_competency_06_ethics_scope_consent_support"],
    "itemIds": ["consultants_item_06"],
    "submissionRules": {
      "allowDraftSave": true,
      "acceptedFormats": ["online", "text"],
      "facultyReviewRequired": true
    },
    "completionRules": {
      "passMarkRequired": true,
      "facultyApprovalRequired": true,
      "mandatoryDomainTags": ["ethics-scope"]
    }
  },
  {
    "id": "consultants_assessment_07_communication_excellence_trust_based_consultation",
    "programId": "program_certificate_consultation_patient_coordination",
    "levelId": "level_consultants_advanced_certificate",
    "moduleId": "consultants_module_07_communication_excellence_trust_based_consultation",
    "slug": "communication-excellence-assessment",
    "title": "Communication Excellence Assessment",
    "assessmentType": "communication-scenario",
    "status": "draft",
    "instructions": "Complete the communication scenario using trust-based and scope-safe language.",
    "passMark": 80,
    "retryLimit": 2,
    "weighting": 8,
    "facultyReviewRequired": true,
    "mandatoryDomainTags": ["communication", "ethics-scope"],
    "competencyIds": ["consultants_competency_07_patient_communication"],
    "itemIds": ["consultants_item_07"],
    "submissionRules": {
      "allowDraftSave": true,
      "acceptedFormats": ["online", "text"],
      "facultyReviewRequired": true
    },
    "completionRules": {
      "passMarkRequired": true,
      "facultyApprovalRequired": true,
      "mandatoryDomainTags": ["communication", "ethics-scope"]
    }
  },
  {
    "id": "consultants_assessment_08_non_surgical_treatment_education",
    "programId": "program_certificate_consultation_patient_coordination",
    "levelId": "level_consultants_advanced_certificate",
    "moduleId": "consultants_module_08_non_surgical_treatment_education",
    "slug": "non-surgical-treatment-education-assessment",
    "title": "Non-Surgical Treatment Education Assessment",
    "assessmentType": "short-answer",
    "status": "draft",
    "instructions": "Answer treatment education prompts using safe and realistic language.",
    "passMark": 80,
    "retryLimit": 2,
    "weighting": 5,
    "facultyReviewRequired": false,
    "mandatoryDomainTags": ["communication"],
    "competencyIds": ["consultants_competency_08_non_surgical_education"],
    "itemIds": ["consultants_item_08"],
    "submissionRules": {
      "allowDraftSave": true,
      "acceptedFormats": ["online"],
      "facultyReviewRequired": false
    },
    "completionRules": {
      "passMarkRequired": true,
      "facultyApprovalRequired": false,
      "mandatoryDomainTags": ["communication"]
    }
  },
  {
    "id": "consultants_assessment_09_surgical_education_for_non_doctors",
    "programId": "program_certificate_consultation_patient_coordination",
    "levelId": "level_consultants_advanced_certificate",
    "moduleId": "consultants_module_09_surgical_education_for_non_doctors",
    "slug": "surgical-education-assessment",
    "title": "Surgical Education for Non-Doctors Assessment",
    "assessmentType": "short-answer",
    "status": "draft",